{
  "agent_id": "internal-medicine-physician",
  "team": "physicians",
  "last_updated": "2026-05-02",
  "entries": [
    {
      "id": "internal-medicine-physician-lesson-0001",
      "type": "lesson",
      "topic": "initial-charter",
      "summary": "Internal Medicine Physician initialized with persistent memory and rubric-linked responsibilities.",
      "confidence": 1,
      "source_ids": [
        "design-spec-2026-05-02"
      ],
      "iteration": 0,
      "status": "active",
      "supersedes": []
    }
  ]
}
