{
  "agent_id": "voice-safety-misuse-attacker",
  "team": "adversarial",
  "last_updated": "2026-05-03",
  "entries": [
    {
      "id": "voice-safety-misuse-attacker-lesson-0001",
      "type": "lesson",
      "topic": "initial-charter",
      "summary": "Voice Safety And Misuse Attacker initialized with persistent memory and rubric-linked responsibilities.",
      "confidence": 1,
      "source_ids": [
        "src-internal-agent-factory-design-spec"
      ],
      "iteration": 0,
      "status": "active",
      "supersedes": []
    },
    {
      "id": "voice-safety-misuse-attacker-risk-0002",
      "type": "risk",
      "topic": "voice-misuse",
      "summary": "Voice cloning or realistic local speech synthesis increases misuse, consent, and learner trust risks; mock voice should remain acceptable for first slice.",
      "confidence": 0.9,
      "source_ids": [
        "src-vibevoice-github-2026"
      ],
      "iteration": 7,
      "status": "active",
      "supersedes": []
    }
  ]
}
