{
  "agent_id": "solution-architect",
  "team": "core",
  "last_updated": "2026-05-03",
  "entries": [
    {
      "id": "solution-architect-lesson-0001",
      "type": "lesson",
      "topic": "initial-charter",
      "summary": "Solution Architect initialized with persistent memory and rubric-linked responsibilities.",
      "confidence": 1,
      "source_ids": [
        "design-spec-2026-05-02"
      ],
      "iteration": 0,
      "status": "active",
      "supersedes": []
    },
    {
      "id": "solution-architect-decision-0002",
      "type": "decision",
      "topic": "exam-blueprint-form-station-actor-architecture",
      "summary": "Use ExamBlueprint, ExamForm, Station, ActorCard, StationRun, TraceEvent, ReviewPacket, and KnowledgeGraph nodes as the primary implementation boundaries for the clinical skills exam platform.",
      "confidence": 0.88,
      "source_ids": [
        "src-usmle-2020-bulletin-step2cs",
        "src-cellixjs-ddd-docs-2026",
        "src-cellixjs-monorepo-pipeline-docs-2026",
        "src-internal-openclinxr-architecture-bundle"
      ],
      "iteration": 2,
      "status": "active",
      "supersedes": []
    },
    {
      "id": "solution-architect-decision-0003",
      "type": "decision",
      "topic": "provider-adapter-and-communication-profile-architecture",
      "summary": "Model, voice, and local LLM capabilities should be exposed through auditable provider adapters, while every actor card carries a communication profile, bounded-stubbornness policy, and emotion/style QA hooks.",
      "confidence": 0.88,
      "source_ids": [
        "src-xai-grok-voice-think-fast-2026",
        "src-xai-voice-api-docs-2026",
        "src-local-laverde-llm-agents-pdf-2025",
        "src-local-bodonhelyi-medical-communication-pdf-2025"
      ],
      "iteration": 3,
      "status": "active",
      "supersedes": []
    }
  ]
}
