{
  "agent_id": "cfo-operations-lead",
  "team": "leadership",
  "last_updated": "2026-05-02",
  "entries": [
    {
      "id": "cfo-operations-lead-lesson-0001",
      "type": "lesson",
      "topic": "initial-charter",
      "summary": "CFO And Operations Lead initialized with persistent memory and rubric-linked responsibilities.",
      "confidence": 1,
      "source_ids": [
        "design-spec-2026-05-02"
      ],
      "iteration": 0,
      "status": "active",
      "supersedes": []
    }
  ]
}
