{
  "agent_id": "chief-medical-education-officer",
  "team": "leadership",
  "last_updated": "2026-05-02",
  "entries": [
    {
      "id": "chief-medical-education-officer-lesson-0001",
      "type": "lesson",
      "topic": "initial-charter",
      "summary": "Chief Medical Education Officer initialized with persistent memory and rubric-linked responsibilities.",
      "confidence": 1,
      "source_ids": [
        "src-internal-agent-factory-design-spec"
      ],
      "iteration": 0,
      "status": "active",
      "supersedes": []
    }
  ]
}
